{
  "contentSha256": "eec5b180e2d7b8f0251a2bcbd383bbcb128b4a8985bea38990d25c258122ad3e",
  "entryPoint": "python -m agent_skills.validate --root .",
  "files": [
    {
      "group": "linear",
      "path": "__main__.py",
      "sha256": "774a27f2d3735b41724bec116a482830f5a94e933eef0db7137152360193ef55"
    },
    {
      "group": "linear",
      "path": "agent_skills/__init__.py",
      "sha256": "d0e787364a615d06c795fcafa7a0c316d1b96d245719d2949035eacb0b69467c"
    },
    {
      "group": "linear",
      "path": "agent_skills/adoption.py",
      "sha256": "bad0d6490e99b083f0c48bca9ee1938282b9db8bed637f988770ffe170ab87fd"
    },
    {
      "group": "linear",
      "path": "agent_skills/capabilities.py",
      "sha256": "e78a08ce86d31523d27a4b3ab965db5b28ad4d05395b2c67f8de8781cad03d83"
    },
    {
      "group": "linear",
      "path": "agent_skills/catalog.py",
      "sha256": "8a972ba49915ebab6c81859928dce8d98771158d7a38691ae0e46079d01c8ab0"
    },
    {
      "group": "linear",
      "path": "agent_skills/cli.py",
      "sha256": "e7ffde4db6b0c3edefca9735ff4568a6a16b65b8facaabe789badb18c1fec293"
    },
    {
      "group": "linear",
      "path": "agent_skills/diagnosis.py",
      "sha256": "2dc66428783815697096528620c2178ee58711bd437bd05dcf5667de9af9b2dd"
    },
    {
      "group": "linear",
      "path": "agent_skills/errors.py",
      "sha256": "e33e120e1cd4f34815e59db4f405e208646341bd4a0a1a4981f78a792fde0d51"
    },
    {
      "group": "linear",
      "path": "agent_skills/fake_tracker.py",
      "sha256": "a146f90f33617700a77a076f7e3ff43e1cb2fbbd65aaede157fe84073660653a"
    },
    {
      "group": "linear",
      "path": "agent_skills/fs.py",
      "sha256": "0962dc9e75e86e93af8f45363ab74cd3fd0b4d9f7b4845b93f00aa40ab87a499"
    },
    {
      "group": "linear",
      "path": "agent_skills/generations.py",
      "sha256": "e1d4454e511e15cd10efd1ac17218b9d54c01dcf98e7386a609bb59918ebab3a"
    },
    {
      "group": "linear",
      "path": "agent_skills/hosts/__init__.py",
      "sha256": "052789398486518c98b19bf0bfd3ef43755be747e29b244744aee858963a938e"
    },
    {
      "group": "linear",
      "path": "agent_skills/hosts/base.py",
      "sha256": "43e135c27c6f4eb7ef0b1ca1d61ec97952cbc93c4ed8384fe290b5a128059c56"
    },
    {
      "group": "linear",
      "path": "agent_skills/hosts/claude.py",
      "sha256": "f8089cb7d06df5457f6d0464803d5ac13598662029414dc72a5b2413acf51442"
    },
    {
      "group": "linear",
      "path": "agent_skills/hosts/codex.py",
      "sha256": "eed6d1ca2c87dae35969ab358148f82a5b277a69b1da248e6ede2e4a643d8884"
    },
    {
      "group": "linear",
      "path": "agent_skills/hosts/exposure.py",
      "sha256": "dc2675e34f3b3b8ba1ab3f86ec72b5f47f96a6990eb489f106ad1bf91fe1b867"
    },
    {
      "group": "linear",
      "path": "agent_skills/journal.py",
      "sha256": "563803eef2b27d6c69f711a7c1266f404f1659800a825ea6b01a4a33892f74cf"
    },
    {
      "group": "linear",
      "path": "agent_skills/lifecycle.py",
      "sha256": "e8a28f0aa4d0b93c544104f6cf7d868c548b888de1fcd859f27f8bf310f51c30"
    },
    {
      "group": "linear",
      "path": "agent_skills/locking.py",
      "sha256": "7bd592350c23e3a96335a0ab9c20b9a6a44a6f9036f2f250d6726443cd5eda7f"
    },
    {
      "group": "linear",
      "path": "agent_skills/product.py",
      "sha256": "8f01a5e05b6e58f7e2e93f911ad342f8bc9cc770c2c979a9771b63af34b42451"
    },
    {
      "group": "linear",
      "path": "agent_skills/provider.py",
      "sha256": "5f4ddfe4bd2f49085bb84a7b98c9f9365a918bb97b6fef0323cd85ead78a2c76"
    },
    {
      "group": "linear",
      "path": "agent_skills/receipt.py",
      "sha256": "9e88a9531c6910cb342345567a650ecd56e4d0cf7c50d679271ff0729807706c"
    },
    {
      "group": "linear",
      "path": "agent_skills/release.py",
      "sha256": "62564fe8fc4f7da9334246daf0c3f3c227da3aba4eff47178afd08e44a4b8f76"
    },
    {
      "group": "linear",
      "path": "agent_skills/review_orchestration.py",
      "sha256": "b9c4ee9b547946bb8b92143f860047b62505e11160b5918dcc9dffccbb114db1"
    },
    {
      "group": "linear",
      "path": "agent_skills/router.py",
      "sha256": "395da4e6e83affb3c62b5e76941a7cce460cb1b1a051f3888fa8a7c95be03098"
    },
    {
      "group": "linear",
      "path": "agent_skills/validate.py",
      "sha256": "4d3893dfac87bd58adf740dbd8c854c66fe4ae3240be3386a31984cb1d437a6d"
    },
    {
      "group": "linear",
      "path": "agent_skills/workflow_graph.py",
      "sha256": "d5bcd4da3f5baf95edddb13bccea89a3732cf6818c6645b9bd32f7d8eeb689f3"
    },
    {
      "group": "linear",
      "path": "agent_skills/workflows.py",
      "sha256": "9b153caf85d4ab709fc17d8f050e53342984f31f1d69b459ff4259ccd742cc35"
    },
    {
      "group": "linear",
      "path": "catalog.json",
      "sha256": "92ef8a91f3e479c69fc3f54b9ea5bafccc0cdb20d5bd897f48c36c0b73e8695a"
    },
    {
      "group": "linear",
      "path": "docs/agent-skills-provider.md",
      "sha256": "386304181e40d66121adac6e544edbc73d8ad9450913918ec48bbf1809a3df70"
    },
    {
      "group": "linear",
      "path": "docs/delivery-provider-rails-v1.md",
      "sha256": "ffeb3f5fe5baa4f288601e7550b06e1bff36f5160fc0ab48059ea403ed5b1c1e"
    },
    {
      "group": "linear",
      "path": "docs/workflow-graph-v1.md",
      "sha256": "e3f9b6a65c974b2b9e2f1e60d85c078e33b7bfb5c6963881fce91fe3c77392ed"
    },
    {
      "group": "linear",
      "path": "personas/adversarial-document.md",
      "sha256": "57f13fa7506e0906d900a96da56e52671d6aed37662492dd69bb8ddccf42db21"
    },
    {
      "group": "linear",
      "path": "personas/adversarial.md",
      "sha256": "ae9969a9835d66a8fd0b4dca434915f23e2904b5f3865035f887583338571b0d"
    },
    {
      "group": "linear",
      "path": "personas/api-contract.md",
      "sha256": "a04f0415e773b55526cfc9407dbd4f89a7553954930a12060c1625ab14498524"
    },
    {
      "group": "linear",
      "path": "personas/architecture.md",
      "sha256": "c06bb9aa9103c9cefbf5973d963d253e71729267afa082e8c7d48c75a5e7383f"
    },
    {
      "group": "linear",
      "path": "personas/coherence.md",
      "sha256": "4d95807647528c32157179ccf5dde11c669757e1849b7a602b838a91f62c3865"
    },
    {
      "group": "linear",
      "path": "personas/data-integrity.md",
      "sha256": "61b75cb83fc65b8b6fa9a25502362280b4c2761d564166041e1b65e5b179d871"
    },
    {
      "group": "linear",
      "path": "personas/feasibility.md",
      "sha256": "96d39502ab285500af7257aba122684042e0a7e28af6183f6d0336b65961f0df"
    },
    {
      "group": "linear",
      "path": "personas/maintainability.md",
      "sha256": "1da8efccc419a012f5f9ed48c206dadab56efdb44b4488d6ad54ad076e56c691"
    },
    {
      "group": "linear",
      "path": "personas/manifest.json",
      "sha256": "c982e2835063de1fe3986130093e33538f65605eb62124e461d957fbedca1e4e"
    },
    {
      "group": "linear",
      "path": "personas/outcome-correctness.md",
      "sha256": "a5d96a825150e40b840cd91b55c2d7480f5ee7e481004464062afb8ef5430e2c"
    },
    {
      "group": "linear",
      "path": "personas/performance.md",
      "sha256": "c2081d53c1170217f85c41e25058ebf21b1705d17428ccc881422dac3e10abd7"
    },
    {
      "group": "linear",
      "path": "personas/product.md",
      "sha256": "05bdfbf83f85b101c407fdb9ed809dbe33af3ed2314cf4cd130bf6df03240970"
    },
    {
      "group": "linear",
      "path": "personas/project-standards.md",
      "sha256": "72b547422e66609403b3e3382d22f18f242f1ff71b3d3c94ad8c2bc3dcb833d7"
    },
    {
      "group": "linear",
      "path": "personas/reliability.md",
      "sha256": "427bd06015a4ef32d3423e3e56c4a0a113fb1a28a73bad6e7b6068b08e3bb6c3"
    },
    {
      "group": "linear",
      "path": "personas/scope.md",
      "sha256": "117fe6a8ab8cdd125460b2b80ab2510000ca7ab1ac68b10643b27480bb428e6c"
    },
    {
      "group": "linear",
      "path": "personas/security.md",
      "sha256": "f66e55bec2638faaf7ae981bdcba192c09cdc5170f8f2405ff6d890643a04a06"
    },
    {
      "group": "linear",
      "path": "personas/simplicity.md",
      "sha256": "c2e88a11be816b1a8aace86154f05f8fa9a0aba6634806ab0524c24a535b3aaa"
    },
    {
      "group": "linear",
      "path": "personas/source-adjudication.json",
      "sha256": "15a07326dcafbc2cdfc96152014aa5c64e117111dff12087c826a8d9dbf6640f"
    },
    {
      "group": "linear",
      "path": "personas/testing-policy.md",
      "sha256": "ad8a1577e9a5f6de5b0bc431b704dcb72aecd67652b8cd97f8d5706a61864aff"
    },
    {
      "group": "linear",
      "path": "profiles/core.json",
      "sha256": "ba39196542c696cf3d1103be17e66ba9d44137334b100d6636ee1e4bfaed5cf4"
    },
    {
      "group": "linear",
      "path": "profiles/linear.json",
      "sha256": "5ffd94c89d3f706e0bf607464548992858808d52361ff09422fcb65e932282fa"
    },
    {
      "group": "linear",
      "path": "provenance.lock.json",
      "sha256": "e202647c766c868563444e869bd0e54f347a6ce4ae84c1e282a42a40e8a528d7"
    },
    {
      "group": "linear",
      "path": "runtime/LICENSE",
      "sha256": "02ed546806a3298b12c633742eb2fd354821d5dc9a5ee4384d4ae8196737a83f"
    },
    {
      "group": "linear",
      "path": "runtime/NOTICE",
      "sha256": "547c61e2d762d0cadff8c1560ac7b9c072d4d71315797e11629654079ce0882d"
    },
    {
      "group": "linear",
      "path": "runtime/bootstrap.mjs",
      "sha256": "5df698a9e5d7bae942ec5a40819ba52b0688cab87c653ee8b42e30160ad1225a"
    },
    {
      "group": "linear",
      "path": "runtime/cli-api.d.mts",
      "sha256": "463fd495446754844c7e9ce50b44fd8975dbf7a0e4b9b7656dbf580cd146aa61"
    },
    {
      "group": "linear",
      "path": "runtime/cli-api.mjs",
      "sha256": "9ac64855ced3ac0f81964caf3d166db25e2bf11a6f40ca8b9a83f8b0f7b9bc13"
    },
    {
      "group": "linear",
      "path": "runtime/cli.mjs",
      "sha256": "e62d6f728048e1847e396e85575bff780a0e76a538443822082442d81fb136b3"
    },
    {
      "group": "linear",
      "path": "runtime/kernel.d.mts",